{"$schema":"https://json-schema.org/draft/2020-12/schema","$id":"https://agile-v.org/schemas/EVIDENCE_SOURCE_PROFILE.schema.json","title":"Evidence source (adapter) capability profile","type":"object","required":["schema_version","compatibility","migration","fixture_owner","adapter"],"properties":{"schema_version":{"const":"1.0"},"compatibility":{"type":"string","minLength":1},"migration":{"type":"string","minLength":1},"fixture_owner":{"type":"string","minLength":1},"adapter":{"type":"object","required":["adapter_id","evidence_type","may_establish","may_not_establish"],"properties":{"adapter_id":{"type":"string","minLength":1},"adapter_version":{"type":"string"},"evidence_type":{"type":"string","minLength":1},"may_establish":{"type":"array","minItems":1,"items":{"type":"string"}},"may_not_establish":{"type":"array","items":{"type":"string"}},"trust_boundary":{"type":"string"}},"additionalProperties":true}},"additionalProperties":false}
